<?xml version="1.0" encoding="UTF-8"?>
        <!ELEMENT macskak (macska)*>
        <!ELEMENT macska (macskaid)*>
        <!ELEMENT macskaid (nev|kor|fajta)*>
        <!ELEMENT nev (#PCDATA)>
        <!ELEMENT kor (#PCDATA)>
        <!ELEMENT fajta (#PCDATA)>