<?xml version="1.0" encoding="UTF-8"?>
<!DOCTYPE macskak SYSTEM "macskakCRC7FC.dtd">
<macskak xmlns:xsi="http://www.w3.org/2001/XMLSchema-instance" xsi:noNamespaceSchemaLocation="macskakCRC7FC.xsd">
    <macska>
        <macskaid>
            <nev>Mihály</nev>
            <kor>10 év</kor>
            <fajta>UV</fajta>
        </macskaid>
        <macskaid>
            <nev>Leo</nev>
            <kor>3 év</kor>
            <fajta>Perzsa</fajta>
        </macskaid>
        <macskaid>
            <nev>Miki</nev>
            <kor>1 év</kor>
            <fajta>Sziámi</fajta>
        </macskaid>
    </macska>
</macskak>